{
  "schema_version": "1.0.0",
  "rule_code": "service-due-rule",
  "description": "Recurring-service verticals with customers nearing their next-service window and no service-due reminder running.",
  "signal": {
    "metric": "customers_nearing_service_due",
    "operator": ">=",
    "threshold": 20
  },
  "conditions": {
    "module_inactive": ["service_due_reminder"],
    "blueprint_in": ["hvac", "pest-control", "cleaning", "med-spa"],
    "capability_present": ["crm", "sms"]
  },
  "module_recommended": "service_due_reminder",
  "bundle_recommended": "retention_pack",
  "headline": "{{signal.value}} customers are due for recurring service soon.",
  "body": "Turn on Service-Due Reminder so every customer gets a 30/14/7-day nudge to rebook before the window closes.",
  "cta_label": "Lock in the rebooks",
  "priority": 76,
  "cooldown_days": 21
}
